Quote-Answer;Merchant Infl;Guard Infl;Commoner Infl;Noble Infl;Alchemists Infl;Clergy Infl;Merchant Pop;Guard Pop;Commoner Pop;Noble Pop;Alchemists Pop;Clergy Pop;Answer
You will throw a royal ball. Who will you invite as a guest of honor?;-;-;-;-;-;-;-;-;-;-;-;-;-
The merchant guild's chief. Even a ball can be a good oportunity for business.;20;0;0;-5;0;0;0;0;0;0;0;0;asdasdasd
The grand duke. Life as nobility is full of hardships, so we must help each other.;-5;0;0;20;0;0;0;0;0;0;0;0;asdasdasd
The captain of the guard. The man who defends our kingdom should be given a night of rest.;0;20;0;-5;0;0;0;0;0;0;0;0;asdasdasd
Some random commoner. You know, we need some new faces in the castle.;0;0;20;-10;0;0;0;0;0;0;0;0;asdasdasdas